Human,Oyavas,EMEA/H/C/005556,Authorised,,R/0000278081,bevacizumab,bevacizumab,"Colorectal Neoplasms;Breast Neoplasms;Ovarian Neoplasms;Fallopian Tube Neoplasms;Peritoneal Neoplasms;Carcinoma, Non-Small-Cell Lung;Carcinoma, Renal Cell;Uterine Cervical Neoplasms",,No,L01FG01,,Antineoplastic agents,,"Oyavas in combination with fluoropyrimidine based chemotherapy is indicated for treatment of adult patients with metastatic carcinoma of the colon or rectum. Oyavas in combination with paclitaxel is indicated for first line treatment of adult patients with metastatic breast cancer. For further information as to human epidermal growth factor receptor 2 (HER2) status, please refer to section 5.1. Oyavas in combination with capecitabine is indicated for first line treatment of adult patients with metastatic breast cancer in whom treatment with other chemotherapy options including taxanes or anthracyclines is not considered appropriate. Patients who have received taxane and anthracycline containing regimens in the adjuvant setting within the last 12 months should be excluded from treatment with Oyavas in combination with capecitabine. For further information as to HER2 status, please refer to section 5.1. Oyavas, in addition to platinum based chemotherapy, is indicated for first line treatment of adult patients with unresectable advanced, metastatic or recurrent non small cell lung cancer other than predominantly squamous cell histology. Oyavas, in combination with erlotinib, is indicated for first line treatment of adult patients with unresectable advanced, metastatic or recurrent non squamous non small cell lung cancer with Epidermal Growth Factor Receptor (EGFR) activating mutations (see section 5.1). Oyavas in combination with interferon alfa 2a is indicated for first line treatment of adult patients with advanced and/or metastatic renal cell cancer. Oyavas, in combination with carboplatin and paclitaxel is indicated for the front line treatment of adult patients with advanced (International Federation of Gynecology and Obstetrics (FIGO) stages III B, III C and IV) epithelial ovarian, fallopian tube, or primary peritoneal cancer (see section 5.1). Oyavas, in combination with carboplatin and gemcitabine or in combination with carboplatin and paclitaxel, is indicated for treatment of adult patients with first recurrence of platinum sensitive epithelial ovarian, fallopian tube or primary peritoneal cancer who have not received prior therapy with bevacizumab or other VEGF inhibitors or VEGF receptor–targeted agents. Oyavas, in combination with topotecan, or pegylated liposomal doxorubicin is indicated for the treatment of adult patients with platinum resistant recurrent epithelial ovarian, fallopian tube, or primary peritoneal cancer who received no more than two prior chemotherapy regimens and who have not received prior therapy with bevacizumab or other VEGF inhibitors or VEGF receptor targeted agents (see Section 5.1). Oyavas, in combination with paclitaxel and cisplatin or, alternatively, paclitaxel and topotecan in patients who cannot receive platinum therapy, is indicated for the treatment of adult patients with persistent, recurrent, or metastatic carcinoma of the cervix (see section 5.1).",No,No,No,Yes,No,No,No,No,No,STADA Arzneimittel AG,15/01/2026,,,28/01/2021,,26/03/2021,,,,9,15/04/2021,28/01/2026,https://www.ema.europa.eu/en/medicines/human/EPAR/oyavas
Human,Aybintio,EMEA/H/C/005106,Authorised,,PSUR/0000274402,bevacizumab,bevacizumab,"Colorectal Neoplasms;Breast Neoplasms;Ovarian Neoplasms;Fallopian Tube Neoplasms;Peritoneal Neoplasms;Carcinoma, Non-Small-Cell Lung;Carcinoma, Renal Cell;Uterine Cervical Neoplasms",,No,L01FG01,,Antineoplastic agents,,"Aybintio in combination with fluoropyrimidine-based chemotherapy is indicated for treatment of adult patients with metastatic carcinoma of the colon or rectum. Aybintio in combination with paclitaxel is indicated for first-line treatment of adult patients with metastatic breast cancer. For further information as to human epidermal growth factor receptor 2 (HER2) status, please refer to section 5.1 of the SmPC. Aybintio in combination with capecitabine is indicated for first-line treatment of adult patients with metastatic breast cancer in whom treatment with other chemotherapy options including taxanes or anthracyclines is not considered appropriate. Patients who have received taxane and anthracyclinecontaining regimens in the adjuvant setting within the last 12 months should be excluded from treatment with Aybintio in combination with capecitabine. For further information as to HER2 status, please refer to section 5.1 of the SmPC. Aybintio, in addition to platinum-based chemotherapy, is indicated for first-line treatment of adult patients with unresectable advanced, metastatic or recurrent non-small cell lung cancer other than predominantly squamous cell histology. Aybintio, in combination with erlotinib, is indicated for first-line treatment of adult patients with unresectable advanced, metastatic or recurrent non-squamous non-small cell lung cancer with Epidermal Growth Factor Receptor (EGFR) activating mutations (see section 5.1 of the SmPC). Aybintio in combination with interferon alfa-2a is indicated for first line treatment of adult patients with advanced and/or metastatic renal cell cancer. Aybintio, in combination with carboplatin and paclitaxel is indicated for the front-line treatment of adult patients with advanced (International Federation of Gynecology and Obstetrics (FIGO) stages III B, III C and IV) epithelial ovarian, fallopian tube, or primary peritoneal cancer (see section 5.1 of the SmPC). Aybintio, in combination with carboplatin and gemcitabine or in combination with carboplatin and paclitaxel, is indicated for treatment of adult patients with first recurrence of platinum-sensitive epithelial ovarian, fallopian tube or primary peritoneal cancer who have not received prior therapy with bevacizumab or other VEGF inhibitors or VEGF receptor targeted agents. Aybintio, in combination with topotecan, or pegylated liposomal doxorubicin is indicated for the treatment of adult patients with platinum-resistant recurrent epithelial ovarian, fallopian tube, or primary peritoneal cancer who received no more than two prior chemotherapy regimens and who have not received prior therapy with bevacizumab or other VEGF inhibitors or VEGF receptor targeted agents (see section 5.1 of the SmPC). Aybintio, in combination with paclitaxel and cisplatin or, alternatively, paclitaxel and topotecan in patients who cannot receive platinum therapy, is indicated for the treatment of adult patients with persistent, recurrent, or metastatic carcinoma of the cervix (see section 5.1 of the SmPC).",No,No,No,Yes,No,No,No,No,No,Samsung Bioepis NL B.V.,18/12/2025,,,25/06/2020,,19/08/2020,,,,12,2020/2/9,28/01/2026,https://www.ema.europa.eu/en/medicines/human/EPAR/aybintio
Human,Avastin,EMEA/H/C/000582,Authorised,,VR/0000316070,bevacizumab,bevacizumab,"Carcinoma, Non-Small-Cell Lung;Breast Neoplasms;Ovarian Neoplasms;Colorectal Neoplasms;Carcinoma, Renal Cell;Fallopian Tube Neoplasms;Peritoneal Neoplasms;Uterine Cervical Neoplasms",,No,L01FG01,,Antineoplastic agents,,"Bevacizumab in combination with fluoropyrimidine-based chemotherapy is indicated for treatment of adult patients with metastatic carcinoma of the colon or rectum. Bevacizumab in combination with paclitaxel is indicated for first-line treatment of adult patients with metastatic breast cancer. For further information as to human epidermal growth factor receptor 2 (HER2) status. Bevacizumab in combination with capecitabine is indicated for first-line treatment of adult patients with metastatic breast cancer in whom treatment with other chemotherapy options including taxanes or anthracyclines is not considered appropriate. Patients who have received taxane and anthracycline-containing regimens in the adjuvant setting within the last 12 months should be excluded from treatment with Avastin in combination with capecitabine. For further information as to HER2 status. Bevacizumab, in addition to platinum-based chemotherapy, is indicated for first-line treatment of adult patients with unresectable advanced, metastatic or recurrent non-small cell lung cancer other than predominantly squamous cell histology. Bevacizumab, in combination with erlotinib, is indicated for first-line treatment of adult patients with unresectable advanced, metastatic or recurrent non-squamous non-small cell lung cancer with Epidermal Growth Factor Receptor (EGFR) activating mutations. Bevacizumab in combination with interferon alfa-2a is indicated for first line treatment of adult patients with advanced and/or metastatic renal cell cancer. Bevacizumab, in combination with carboplatin and paclitaxel is indicated for the front-line treatment of adult patients with advanced (International Federation of Gynecology and Obstetrics (FIGO) stages III B, III C and IV) epithelial ovarian, fallopian tube, or primary peritoneal cancer.Bevacizumab, in combination with carboplatin and gemcitabine, is indicated for treatment of adult patients with first recurrence of platinum-sensitive epithelial ovarian, fallopian tube or primary peritoneal cancer who have not received prior therapy with bevacizumab or other VEGF inhibitors or VEGF receptor–targeted agents. Bevacizumab in combination with paclitaxel, topotecan, or pegylated liposomal doxorubicin is indicated for the treatment of adult patients with platinum-resistant recurrent epithelial ovarian, fallopian tube, or primary peritoneal cancer who received no more than two prior chemotherapy regimens and who have not received prior therapy with bevacizumab or other VEGF inhibitors or VEGF receptor–targeted agents. Bevacizumab, in combination with paclitaxel and cisplatin or, alternatively, paclitaxel and topotecan in patients who cannot receive platinum therapy, is indicated for the treatment of adult patients with persistent, recurrent, or metastatic carcinoma of the cervix.",No,No,No,No,No,No,No,No,No,Roche Registration GmbH,2026/12/1,,,,,2005/12/1,,,,68,2018/9/8,27/01/2026,https://www.ema.europa.eu/en/medicines/human/EPAR/avastin
Human,Mvasi,EMEA/H/C/004728,Authorised,,PSUR/0000274402,bevacizumab,bevacizumab,"Carcinoma, Renal Cell;Peritoneal Neoplasms;Ovarian Neoplasms;Breast Neoplasms;Carcinoma, Non-Small-Cell Lung;Fallopian Tube Neoplasms",,No,L01XC07,,Antineoplastic agents,,"Mvasi in combination with fluoropyrimidine-based chemotherapy is indicated for treatment of adult patients with metastatic carcinoma of the colon or rectum. Mvasi in combination with paclitaxel is indicated for first-line treatment of adult patients with metastatic breast cancer. For further information as to human epidermal growth factor receptor 2 (HER2) status, please refer to section 5.1. Mvasi, in addition to platinum-based chemotherapy, is indicated for first-line treatment of adult patients with unresectable advanced, metastatic or recurrent non-small cell lung cancer other than predominantly squamous cell histology. Mvasi in combination with interferon alfa-2a is indicated for first-line treatment of adult patients with advanced and/or metastatic renal cell cancer. Mvasi, in combination with carboplatin and paclitaxel is indicated for the front-line treatment of adult patients with advanced (International Federation of Gynecology and Obstetrics (FIGO) stages IIIB, IIIC and IV) epithelial ovarian, fallopian tube, or primary peritoneal cancer. Mvasi, in combination with carboplatin and gemcitabine or in combination with carboplatin and paclitaxel, is indicated for treatment of adult patients with first recurrence of platinum-sensitive epithelial ovarian, fallopian tube or primary peritoneal cancer who have not received prior therapy with bevacizumab or other VEGF inhibitors or VEGF receptor-targeted agents. Mvasi in combination with paclitaxel, topotecan, or pegylated liposomal doxorubicin is indicated for the treatment of adult patients with platinum-resistant recurrent epithelial ovarian, fallopian tube, or primary peritoneal cancer who received no more than two prior chemotherapy regimens and who have not received prior therapy with bevacizumab or other VEGF inhibitors or VEGF receptor-targeted agents. Mvasi, in combination with paclitaxel and cisplatin or, alternatively, paclitaxel and topotecan in patients who cannot receive platinum therapy, is indicated for the treatment of adult patients with persistent, recurrent, or metastatic carcinoma of the cervix.",No,No,No,Yes,No,No,No,No,No,Amgen Technology (Ireland) UC,19/12/2025,,,2017/8/11,,15/01/2018,,,,18,2018/12/2,27/01/2026,https://www.ema.europa.eu/en/medicines/human/EPAR/mvasi
Human,Tevimbra,EMEA/H/C/005919,Authorised,,VR/0000269879,tislelizumab,tislelizumab,"Esophageal Squamous Cell Carcinoma;Carcinoma, Non-Small-Cell Lung;Small Cell Lung Carcinoma;Nasopharyngeal Carcinoma;Stomach Neoplasms",,No,L01FF09,,Antineoplastic agents,,"Non-small cell lung cancer (NSCLC) Tevimbra, in combination with platinum-containing chemotherapy as neoadjuvant treatment and then continued as monotherapy as adjuvant treatment, is indicated for the treatment of adult patients with resectable NSCLC at high risk of recurrence (for selection criteria, see section 5.1).Tevimbra in combination with pemetrexed and platinum containing chemotherapy is indicated for the first-line treatment of adult patients with non-squamous NSCLC&nbsp; whose tumours have PD-L1 expression on ≥50% of tumour cells with no EGFR or ALK positive mutations and who have:  locally advanced NSCLC and are not candidates for surgical resection or platinum-based chemoradiation, or metastatic NSCLC.  Tevimbra in combination with carboplatin and either paclitaxel or nab-paclitaxel is indicated for the first-line treatment of adult patients with squamous NSCLC who have:  locally advanced NSCLC and are not candidates for surgical resection or platinum-based chemoradiation, or metastatic NSCLC.  Tevimbra as monotherapy is indicated for the treatment of adult patients with locally advanced or metastatic NSCLC after prior platinum-based therapy. Patients with EGFR mutant or ALK positive NSCLC should also have received targeted therapies before receiving tislelizumab. Small Cell Lung Cancer (SCLC)Tevimbra, in combination with etoposide and platinum chemotherapy, is indicated for the first-line treatment of adult patients with extensive-stage SCLC. Gastric or gastroesophageal junction (G/GEJ) adenocarcinomaTevimbra, in combination with platinum and fluoropyrimidine-based chemotherapy, is indicated for the first-line treatment of adult patients with HER-2-negative locally advanced unresectable or metastatic gastric or gastroesophageal junction (G/GEJ) adenocarcinoma whose tumours express PD L1 with a tumour area positivity (TAP) score ≥ 5% (see section 5.1).Oesophageal squamous cell carcinoma (OSCC)Tevimbra, in combination with platinum-based chemotherapy, is indicated for the first-line treatment of adult patients with unresectable, locally advanced or metastatic OSCC whose tumours express PD L1 with a TAP score ≥ 5% (see section 5.1).Tevimbra as monotherapy is indicated for the treatment of adult patients with unresectable, locally advanced or metastatic OSCC after prior platinum-based chemotherapy. Nasopharyngeal carcinoma (NPC)Tevimbra, in combination with gemcitabine and cisplatin, is indicated for the first-line treatment of adult patients with recurrent, not amenable to curative surgery or radiotherapy, or metastatic NPC.",No,Yes,No,No,No,No,No,No,No,Beone Medicines Ireland Limited,24/10/2025,,,20/07/2023,,15/09/2023,,,,16,17/07/2023,26/01/2026,https://www.ema.europa.eu/en/medicines/human/EPAR/tevimbra
Human,Abraxane,EMEA/H/C/000778,Authorised,,VR/0000311114,paclitaxel,paclitaxel,"Breast Neoplasms;Pancreatic Neoplasms;Carcinoma, Non-Small-Cell Lung",,No,L01CD01,,Antineoplastic agents,,"Abraxane monotherapy is indicated for the treatment of metastatic breast cancer in adult patients who have failed first-line treatment for metastatic disease and for whom standard, anthracycline containing therapy is not indicated. Abraxane in combination with gemcitabine is indicated for the first-line treatment of adult patients with metastatic adenocarcinoma of the pancreas. Abraxane in combination with carboplatin is indicated for the first-line treatment of non-small cell lung cancer in adult patients who are not candidates for potentially curative surgery and/or radiation therapy.",No,No,No,No,No,No,No,No,No,Bristol-Myers Squibb Pharma EEIG,20/01/2026,,,18/10/2007,,2008/11/1,,,,32,30/07/2018,21/01/2026,https://www.ema.europa.eu/en/medicines/human/EPAR/abraxane
Human,Libtayo,EMEA/H/C/004844,Authorised,,VR/0000264999,cemiplimab,cemiplimab,"Carcinoma, Squamous Cell",,No,L01XC33,,Antineoplastic agents,,"Cutaneous Squamous Cell Carcinoma  Libtayo as monotherapy is indicated for the treatment of adult patients with metastatic or locally advanced cutaneous squamous cell carcinoma (mCSCC or laCSCC) who are not candidates for curative surgery or curative radiation. Libtayo as monotherapy is indicated for the adjuvant treatment of adult patients with CSCC at high risk of recurrence after surgery and radiation (see section 5.1 for selection criteria).&nbsp;  Basal Cell Carcinoma  Libtayo as monotherapy is indicated for the treatment of adult patients with locally advanced or metastatic basal cell carcinoma (laBCC or mBCC) who have progressed on or are intolerant to a hedgehog pathway inhibitor (HHI).  Non-Small Cell Lung Cancer  Libtayo as monotherapy is indicated for the first-line treatment of adult patients with non-small cell lung cancer (NSCLC) expressing PD-L1 (in ? 50% tumour cells), with no EGFR, ALK or ROS1 aberrations, who have:  locally advanced NSCLC who are not candidates for definitive chemoradiation, or metastatic NSCLC.   Libtayo in combination with platinum?based chemotherapy is indicated for the first?line treatment of adult patients with NSCLC expressing PD-L1 (in ? 1% of tumour cells), with no EGFR, ALK or ROS1 aberrations, who have:  locally advanced NSCLC who are not candidates for definitive chemoradiation, or metastatic NSCLC.    Cervical Cancer  Libtayo as monotherapy is indicated for the treatment of adult patients with recurrent or metastatic cervical cancer and disease progression on or after platinum-based chemotherapy.",No,No,No,No,No,No,No,No,No,Regeneron Ireland Designated Activity Company (DAC),17/11/2025,,,26/04/2019,,28/06/2019,,,,22,2019/5/7,20/01/2026,https://www.ema.europa.eu/en/medicines/human/EPAR/libtayo
Human,Hycamtin,EMEA/H/C/000123,Authorised,,N/0000320277,topotecan,topotecan,Ovarian Neoplasms;Uterine Cervical Neoplasms;Small Cell Lung Carcinoma,,No,L01CE01,,Antineoplastic agents,,Hycamtin capsules are indicated as monotherapy for the treatment of adult patients with relapsed small cell lung cancer (SCLC) for whom re-treatment with the first-line regimen is not considered appropriate. Topotecan is indicated for the treatment of patients with metastatic carcinoma of the ovary after failure of first-line or subsequent therapy. Hycamtin capsules are indicated as monotherapy for the treatment of adult patients with relapsed small cell lung cancer (SCLC) for whom re-treatment with the first-line regimen is not considered appropriate.,No,No,No,No,No,No,No,No,No,Sandoz Pharmaceuticals d.d.,20/01/2026,,,17/07/1996,,1996/12/11,,,,42,23/04/2018,20/01/2026,https://www.ema.europa.eu/en/medicines/human/EPAR/hycamtin
Human,Tagrisso,EMEA/H/C/004124,Authorised,,VR/0000310732,osimertinib,osimertinib mesilate,"Carcinoma, Non-Small-Cell Lung",,No,L01XE,,Other antineoplastic agents;Protein kinase inhibitors,,"TAGRISSO as monotherapy is indicated for:  the adjuvant treatment after complete tumour resection in adult patients with stage IB-IIIA non-small cell lung cancer (NSCLC) whose tumours have epidermal growth factor receptor (EGFR) exon 19 deletions or exon 21 (L858R) substitution mutations (see section 5.1). the treatment of adult patients with locally advanced, unresectable NSCLC whose tumours have EGFR exon 19 deletions or exon 21 (L858R) substitution mutations and whose disease has not progressed during or following platinum‑based chemoradiation therapy. the first-line treatment of adult patients with locally advanced or metastatic NSCLC with activating EGFR mutations. the treatment of adult patients with locally advanced or metastatic EGFR T790M mutation-positive NSCLC.  TAGRISSO is indicated in combination with:  pemetrexed and platinum-based chemotherapy for the first-line treatment of adult patients with advanced NSCLC whose tumours have EGFR exon 19 deletions or exon 21 (L858R) substitution mutations.",Yes,No,No,No,No,No,No,No,No,AstraZeneca AB,2025/3/12,,,17/12/2015,,2016/1/2,,,,23,31/08/2018,19/01/2026,https://www.ema.europa.eu/en/medicines/human/EPAR/tagrisso
Human,Alimta,EMEA/H/C/000564,Authorised,,VR/0000315508,pemetrexed,pemetrexed,"Mesothelioma;Carcinoma, Non-Small-Cell Lung",,No,L01BA04,,Antineoplastic agents,,Malignant pleural mesothelioma Alimta in combination with cisplatin is indicated for the treatment of chemotherapy-naïve patients with unresectable malignant pleural mesothelioma. Non-small-cell lung cancer Alimta in combination with cisplatin is indicated for the first-line treatment of patients with locally advanced or metastatic non-small-cell lung cancer other than predominantly squamous cell histology. Alimta is indicated as monotherapy for the maintenance treatment of locally advanced or metastatic non-small-cell lung cancer other than predominantly squamous cell histology in patients whose disease has not progressed immediately following platinum-based chemotherapy. Alimta is indicated as monotherapy for the second line treatment of patients with locally advanced or metastatic non-small-cell lung cancer other than predominantly squamous cell histology.,No,No,No,No,No,No,No,No,No,Eli Lilly Nederland B.V.,16/01/2026,,,,,20/09/2004,,,,29,23/03/2018,16/01/2026,https://www.ema.europa.eu/en/medicines/human/EPAR/alimta
Human,Cyramza,EMEA/H/C/002829,Authorised,,VR/0000315508,ramucirumab,ramucirumab,Stomach Neoplasms,,No,L01FX06,,Antineoplastic agents,,"Gastric cancer Cyramza in combination with paclitaxel is indicated for the treatment of adult patients with advanced gastric cancer or gastro-oesophageal junction adenocarcinoma with disease progression after prior platinum and fluoropyrimidine chemotherapy. Cyramza monotherapy is indicated for the treatment of adult patients with advanced gastric cancer or gastro-oesophageal junction adenocarcinoma with disease progression after prior platinum or fluoropyrimidine chemotherapy, for whom treatment in combination with paclitaxel is not appropriate. Colorectal cancer Cyramza, in combination with FOLFIRI (irinotecan, folinic acid, and 5?fluorouracil), is indicated for the treatment of adult patients with metastatic colorectal cancer (mCRC) with disease progression on or after prior therapy with bevacizumab, oxaliplatin and a fluoropyrimidine. Non-small cell lung cancer Cyramza in combination with docetaxel is indicated for the treatment of adult patients with locally advanced or metastatic non-small cell lung cancer with disease progression after platinum-based chemotherapy. Hepatocellular carcinoma Cyramza monotherapy is indicated for the treatment of adult patients with advanced or unresectable hepatocellular carcinoma who have a serum alpha fetoprotein (AFP) of ?&nbsp;400&nbsp;ng/ml and who have been previously treated with sorafenib.",No,No,No,No,No,No,No,No,No,Eli Lilly Nederland B.V.,16/01/2026,,,,,19/12/2014,,,,22,2018/12/2,16/01/2026,https://www.ema.europa.eu/en/medicines/human/EPAR/cyramza
Human,Pemetrexed Pfizer (previously Pemetrexed Hospira),EMEA/H/C/003970,Authorised,,N/0000323208,pemetrexed,pemetrexed disodium;pemetrexed disodium hemipentahydrate,"Carcinoma, Non-Small-Cell Lung;Mesothelioma",,No,L01BA04,,Antineoplastic agents,,Malignant pleural mesothelioma Pemetrexed Pfizer in combination with cisplatin is indicated for the treatment of chemotherapy naïve patients with unresectable malignant pleural mesothelioma. Non-small cell lung cancer Pemetrexed Pfizer in combination with cisplatin is indicated for the first-line treatment of patients with locally advanced or metastatic non-small cell lung cancer other than predominantly squamous cell histology. Pemetrexed Pfizer is indicated as monotherapy for the maintenance treatment of locally advanced or metastatic non-small cell lung cancer other than predominantly squamous cell histology in patients whose disease has not progressed immediately following platinum-based chemotherapy. Pemetrexed Pfizer is indicated as monotherapy for the second-line treatment of patients with locally advanced or metastatic non-small cell lung cancer other than predominantly squamous cell histology.,No,No,No,No,No,No,Yes,No,No,Pfizer Europe MA EEIG,15/01/2026,,,23/09/2015,,19/11/2015,,,,19,24/04/2018,15/01/2026,https://www.ema.europa.eu/en/medicines/human/EPAR/pemetrexed-pfizer
Human,Hetronifly,EMEA/H/C/006170,Authorised,,VR/0000291455,serplulimab,serplulimab,Small Cell Lung Carcinoma,,No,L01FF12,,Antineoplastic agents,,Hetronifly in combination with carboplatin and etoposide is indicated for the first-line treatment of adult patients with extensive-stage small cell lung cancer (ES-SCLC).,No,Yes,No,No,No,No,No,Yes,No,Accord Healthcare S.L.U.,2025/4/12,,,19/09/2024,,2025/3/2,,,,4,20/09/2024,2026/12/1,https://www.ema.europa.eu/en/medicines/human/EPAR/hetronifly
