PMID,Title,Authors,Citation,First Author,Journal/Book,Publication Year,Create Date,PMCID,NIHMS ID,DOI,pubmed_url,second_link,pdf_url,download_status,download_error
40082695,A B7H3-targeting antibody-drug conjugate in advanced solid tumors: a phase 1/1b trial,"Ma Y, Yang Y, Huang Y, Fang W, Xue J, Meng X, Fan Y, Fu S, Wu L, Zheng Y, Liu J, Liu Z, Zhuang W, Rosen S, Qu S, Li B, Li M, Zhao Y, Yang S, Ji Y, Sommerhalder D, Luo S, Yang K, Li J, Lv D, Zhang P, Zhao Y, Hong S, Zhang Y, Zhao S, Chin S, Zhang X, Lian W, Cai J, Xue T, Zhang L, Zhao H.",Nat Med. 2025 Jun;31(6):1949-1957. doi: 10.1038/s41591-025-03600-2. Epub 2025 Mar 13.,Ma Y,Nat Med,2025,2025/3/14,PMC12176648,,10.1038/s41591-025-03600-2,https://pubmed.ncbi.nlm.nih.gov/40082695/,https://pmc.ncbi.nlm.nih.gov/articles/PMC12176648/,https://pmc.ncbi.nlm.nih.gov/articles/PMC12176648/pdf/41591_2025_Article_3600.pdf,success,
40072448,Precision Exercise Effect on Fatigue and Function in Lung Cancer Surgery: A Randomized Clinical Trial,"Ulrich CM, Himbert C, Barnes CA, Boucher KM, Daniels B, Bandera VM, Ligibel JA, Wetter DW, Hess R, Kim J, Lundberg K, Mitzman B, Marcus R, Finlayson SRG, LaStayo PC, Varghese TK Jr.",JAMA Surg. 2025 May 1;160(5):495-519. doi: 10.1001/jamasurg.2025.0130.,Ulrich CM,JAMA Surg,2025,2025/3/12,PMC11904799,,10.1001/jamasurg.2025.0130,https://pubmed.ncbi.nlm.nih.gov/40072448/,https://pmc.ncbi.nlm.nih.gov/articles/PMC11904799/,https://pmc.ncbi.nlm.nih.gov/articles/instance/11904799/bin/jamasurg-e250130-s001.pdf,success,
40064573,"The PESGA Trial: A Prospective, Open-Label, Single-Arm, Phase II Study to Evaluate First Line Therapy for Extensive-Stage Small Cell Lung Cancer (ES-SCLC) Patients, Treated by Induction Carboplatin/Etoposide/Pembrolizumab Followed by Maintenance of Pembrolizumab/ Sacituzumab Govitecan","Roisman LC, Mann S, Basel A, Marei R, Krayim B, Kornev G, Asna N, Peled N.",Clin Lung Cancer. 2025 Jun;26(4):267-270. doi: 10.1016/j.cllc.2025.02.002. Epub 2025 Feb 13.,Roisman LC,Clin Lung Cancer,2025,2025/3/10,,,10.1016/j.cllc.2025.02.002,https://pubmed.ncbi.nlm.nih.gov/40064573/,https://linkinghub.elsevier.com/retrieve/pii/S1525-7304(25)00027-0,,skipped,"https://www.clinical-lung-cancer.com/article/S1525-7304(25)00027-0/pdf -> HTTP 403 | 403:text/html; charset=UTF-8:<!DOCTYPE html><html lang=""en-US""><head><title>Just a moment...</title><meta htt"
40058642,Gut Microbiota in Advanced NSCLC Receiving Chemoimmunotherapy: An Ancillary Biomarker Study From the Phase III Trial JCOG2007 (NIPPON),"Hakozaki T, Tanaka K, Shiraishi Y, Sekino Y, Mitome N, Okuma Y, Aiba T, Utsumi T, Tanizaki J, Azuma K, Hara S, Morita R, Niho S, Yokoyama T, Toyozawa R, Horinouchi H, Okamoto I, Hosomi Y, Ohe Y.",J Thorac Oncol. 2025 Jul;20(7):912-927. doi: 10.1016/j.jtho.2025.02.026. Epub 2025 Mar 7.,Hakozaki T,J Thorac Oncol,2025,2025/3/9,,,10.1016/j.jtho.2025.02.026,https://pubmed.ncbi.nlm.nih.gov/40058642/,https://doi.org/10.1016/j.jtho.2025.02.026,,skipped,row_exception:Error
40057343,"Ivonescimab versus pembrolizumab for PD-L1-positive non-small cell lung cancer (HARMONi-2): a randomised, double-blind, phase 3 study in China","Xiong A, Wang L, Chen J, Wu L, Liu B, Yao J, Zhong H, Li J, Cheng Y, Sun Y, Ge H, Yao J, Shi Q, Zhou M, Chen B, Han Z, Wang J, Bu Q, Zhao Y, Chen J, Nie L, Li G, Li X, Yu X, Ji Y, Sun D, Ai X, Chu Q, Lin Y, Hao J, Huang D, Zhou C, Shan J, Yang H, Liu X, Wang J, Shang Y, Mei X, Yang J, Lu D, Hu M, Wang ZM, Li B, Xia M, Zhou C.",Lancet. 2025 Mar 8;405(10481):839-849. doi: 10.1016/S0140-6736(24)02722-3.,Xiong A,Lancet,2025,2025/3/8,,,10.1016/S0140-6736(24)02722-3,https://pubmed.ncbi.nlm.nih.gov/40057343/,https://linkinghub.elsevier.com/retrieve/pii/S0140-6736(24)02722-3,,skipped,row_exception:Error
40054586,Impact of Different Mediastinal Staging Modalities on Target Volume Delineation in Locally Advanced Non-Small Cell Lung Cancer: A Secondary Analysis of the Multicenter Randomized PET-Plan Trial,"Rimner A, Dejonckheere CS, Sahlmann J, Barth SA, Schimek-Jasch T, Adebahr S, Hecht M, Waller CF, Schmid S, Stolz D, Miederer M, Brose A, Binder H, König J, Grosu AL, Nestle U, Gkika E.",Int J Radiat Oncol Biol Phys. 2025 Aug 1;122(5):1217-1226. doi: 10.1016/j.ijrobp.2025.02.041. Epub 2025 Mar 5.,Rimner A,Int J Radiat Oncol Biol Phys,2025,2025/3/7,,,10.1016/j.ijrobp.2025.02.041,https://pubmed.ncbi.nlm.nih.gov/40054586/,https://linkinghub.elsevier.com/retrieve/pii/S0360-3016(25)00196-8,,skipped,row_exception:Error
40050941,Physical activity and lung cancer screening (PALS): feasibility randomised controlled trial of exercise and physical activity in lung cancer screening,"Bonney A, Granger CL, Steinfort D, Patrick C, Marshall HM, Fong KM, Manser R.",Respir Res. 2025 Mar 6;26(1):89. doi: 10.1186/s12931-025-03158-0.,Bonney A,Respir Res,2025,2025/3/6,PMC11884085,,10.1186/s12931-025-03158-0,https://pubmed.ncbi.nlm.nih.gov/40050941/,https://pmc.ncbi.nlm.nih.gov/articles/PMC11884085/,https://pmc.ncbi.nlm.nih.gov/articles/PMC11884085/pdf/12931_2025_Article_3158.pdf,success,
40048631,Effect of psychological intervention combined with feedback-based health education on lung cancer patients,"Huang Y, Xu X, Weng F, Su C.",Rev Esc Enferm USP. 2025 Mar 3;58:e20240170. doi: 10.1590/1980-220X-REEUSP-2024-0170en. eCollection 2025.,Huang Y,Rev Esc Enferm USP,2025,2025/3/6,PMC11884824,,10.1590/1980-220X-REEUSP-2024-0170en,https://pubmed.ncbi.nlm.nih.gov/40048631/,https://pmc.ncbi.nlm.nih.gov/articles/PMC11884824/,https://pmc.ncbi.nlm.nih.gov/articles/PMC11884824/pdf/1980-220X-reeusp-58-e20240170.pdf,success,
40048159,Lung Cancer Surveillance for Patients With Head and Neck Cancer,"Fnais N, Laxague F, Mascarella MA, Chowdhury R, Zhao H, Jatana S, Aljassim A, Roy CF, Alrasheed AS, Chan DS, Agulnik J, Forghani R, Sultanem K, Mlynarek A, Hier MP.",JAMA Otolaryngol Head Neck Surg. 2025 Apr 1;151(4):328-334. doi: 10.1001/jamaoto.2024.3738.,Fnais N,JAMA Otolaryngol Head Neck Surg,2025,2025/3/6,PMC11886864,,10.1001/jamaoto.2024.3738,https://pubmed.ncbi.nlm.nih.gov/40048159/,https://pmc.ncbi.nlm.nih.gov/articles/PMC11886864/,https://pmc.ncbi.nlm.nih.gov/articles/PMC11886864/,success,
40041932,Randomized Phase II Clinical Trial of Sulforaphane in Former Smokers at High Risk for Lung Cancer,"Yuan JM, Kensler TW, Dacic S, Hartman DJ, Wang R, Balogh PA, Sufka P, Turner MA, Fuhrer K, Seigh L, Pham YT, Adams-Haduch J, Valacchi G, Singh SV, Herman JG, Wilson DO.",Cancer Prev Res (Phila). 2025 Jun 2;18(6):335-345. doi: 10.1158/1940-6207.CAPR-24-0386.,Yuan JM,Cancer Prev Res (Phila),2025,2025/3/5,,,10.1158/1940-6207.CAPR-24-0386,https://pubmed.ncbi.nlm.nih.gov/40041932/,https://doi.org/10.1158/1940-6207.capr-24-0386,https://aacrjournals.org/cancerpreventionresearch/article-pdf/18/6/335/3607601/capr-24-0386.pdf,skipped,https://aacrjournals.org/cancerpreventionresearch/article-pdf/doi/10.1158/1940-6207.CAPR-24-0386/3558210/capr-24-0386.pdf -> host_blocked_cached:aacrjournals.org
40034703,Randomized clinical trial in cancer patients shows immune metabolic effects exerted by formulated bioactive phenolic diterpenes with potential clinical benefits,"Gómez de Cedrón M, Moreno-Rubio J, de la O Pascual V, Alvarez B, Villarino M, Sereno M, Gómez-Raposo C, Roa S, López Gómez M, Merino-Salvador M, Jiménez-Gordo A, Falagán S, Aguayo C, Zambrana F, Tabarés B, Garrido B, Cruz-Gil S, Fernández Díaz CM, Fernández LP, Molina S, Crespo MC, Ouahid Y, Montoya JJ, Ramos Ruíz R, Reglero G, Ramírez de Molina A, Casado E.",Front Immunol. 2025 Feb 17;16:1519978. doi: 10.3389/fimmu.2025.1519978. eCollection 2025.,Gómez de Cedrón M,Front Immunol,2025,2025/3/4,PMC11872936,,10.3389/fimmu.2025.1519978,https://pubmed.ncbi.nlm.nih.gov/40034703/,https://pmc.ncbi.nlm.nih.gov/articles/PMC11872936/,https://pmc.ncbi.nlm.nih.gov/articles/PMC11872936/pdf/fimmu-16-1519978.pdf,success,
40032375,Cost-effectiveness analysis of penpulimab combined with paclitaxel and carboplatin as a first-line treatment for metastatic squamous non-small cell lung cancer in China,"Wang L, Lv N, Gao Y, Yan C, Huo X, Diao R.",BMJ Open. 2025 Mar 3;15(3):e091650. doi: 10.1136/bmjopen-2024-091650.,Wang L,BMJ Open,2025,2025/3/3,PMC11883829,,10.1136/bmjopen-2024-091650,https://pubmed.ncbi.nlm.nih.gov/40032375/,https://pmc.ncbi.nlm.nih.gov/articles/PMC11883829/,https://pmc.ncbi.nlm.nih.gov/articles/PMC11883829/pdf/bmjopen-15-3.pdf,success,
40030100,"HER2-Selective Tyrosine Kinase Inhibitor, Zongertinib (BI 1810631), in Patients With Advanced/Metastatic Solid Tumors With HER2 Alterations: A Phase Ia Dose-Escalation Study","Heymach JV, Opdam F, Barve M, Tu HY, Wu YL, Berz D, Schröter L, Botilde Y, Sadrolhefazi B, Serra J, Yoh K, Yamamoto N.",J Clin Oncol. 2025 Apr 10;43(11):1337-1347. doi: 10.1200/JCO-24-01727. Epub 2025 Mar 3.,Heymach JV,J Clin Oncol,2025,2025/3/3,PMC11974636,,10.1200/JCO-24-01727,https://pubmed.ncbi.nlm.nih.gov/40030100/,https://pmc.ncbi.nlm.nih.gov/articles/PMC11974636/,https://pmc.ncbi.nlm.nih.gov/articles/PMC11974636/pdf/jco-43-1337.pdf,success,
40029643,Integrating Tobacco Treatment Into Lung Cancer Screening: The Screen Assist Factorial Randomized Clinical Trial,"Park ER, Haas JS, Rigotti NA, Neil JM, Marotta CJ, Wint AJ, Gonzalez I, McGovern SE, Chang Y, Levy DE, Flores EJ, Merker VL, Noonan E, Bliss CC.",JAMA Intern Med. 2025 May 1;185(5):531-539. doi: 10.1001/jamainternmed.2024.8399.,Park ER,JAMA Intern Med,2025,2025/3/3,PMC11877408,,10.1001/jamainternmed.2024.8399,https://pubmed.ncbi.nlm.nih.gov/40029643/,https://pmc.ncbi.nlm.nih.gov/articles/PMC11877408/,https://pmc.ncbi.nlm.nih.gov/articles/PMC11877408/,success,
40025391,Patient-Reported Outcomes for Patients with Previously Treated Small Cell Lung Cancer Receiving Tarlatamab: Results from the DeLLphi-301 Phase 2 Trial,"Hummel HD, Ahn MJ, Blackhall F, Reck M, Akamatsu H, Ramalingam SS, Borghaei H, Johnson M, Dirnberger F, Cocks K, Huang S, Mukherjee S, Paz-Ares L.",Adv Ther. 2025 Apr;42(4):1950-1964. doi: 10.1007/s12325-025-03136-4. Epub 2025 Mar 3.,Hummel HD,Adv Ther,2025,2025/3/2,PMC11929685,,10.1007/s12325-025-03136-4,https://pubmed.ncbi.nlm.nih.gov/40025391/,https://pmc.ncbi.nlm.nih.gov/articles/PMC11929685/,https://pmc.ncbi.nlm.nih.gov/articles/PMC11929685/pdf/12325_2025_Article_3136.pdf,success,
40024442,First-Line Lorlatinib Versus Crizotinib in Asian Patients With Advanced ALK-Positive NSCLC: Five-Year Outcomes From the CROWN Study,"Wu YL, Kim HR, Soo RA, Zhou Q, Akamatsu H, Chang GC, Chiu CH, Hayashi H, Kim SW, Goto Y, Kato T, Zhou J, Lee VH, Nishio M, Han B, Kim DW, Lu S, Polli A, Martini JF, Toffalorio F, Wong CH, Mok T.",J Thorac Oncol. 2025 Jul;20(7):955-968. doi: 10.1016/j.jtho.2025.02.021. Epub 2025 Feb 28.,Wu YL,J Thorac Oncol,2025,2025/3/2,,,10.1016/j.jtho.2025.02.021,https://pubmed.ncbi.nlm.nih.gov/40024442/,https://doi.org/10.1016/j.jtho.2025.02.021,,skipped,https://www.jto.org/article/S1556-0864(25)00097-8/pdf -> host_blocked_cached:www.jto.org
40023017,"A randomised non-comparative phase II study of atezolizumab, bevacizumab and chemotherapy in EGFR-mutant NSCLC with acquired resistance - The ETOP 15-19 ABC-lung trial","Soo RA, Vervita K, Früh M, Cho BC, Majem M, Rodriguez Abreu D, Ribi K, Callejo A, Moran T, Domine Gomez M, Provencio M, Addeo A, Han JY, Ortega Granados AL, Reck M, Blasco A, Garcia Campelo R, Sala González MA, Britschgi C, Roschitzki-Voser H, Ruepp B, Gasca-Ruchti A, Haberecker M, Dafni U, Peters S, Stahel RA; ETOP 15-19 ABC-lung collaborators.",Lung Cancer. 2025 Apr;202:108454. doi: 10.1016/j.lungcan.2025.108454. Epub 2025 Feb 20.,Soo RA,Lung Cancer,2025,2025/3/1,,,10.1016/j.lungcan.2025.108454,https://pubmed.ncbi.nlm.nih.gov/40023017/,https://linkinghub.elsevier.com/retrieve/pii/S0169-5002(25)00075-3,,skipped,row_exception:Error
40020696,"Trastuzumab rezetecan, a HER2-directed antibody-drug conjugate, in patients with advanced HER2-mutant non-small-cell lung cancer (HORIZON-Lung): phase 2 results from a multicentre, single-arm study","Li Z, Wang Y, Sun Y, Wang L, Li X, Sun L, He Z, Yang H, Wang Y, Wang Q, Song Z, Hong W, Wang Y, Xia G, Yu Y, Peng M, Song Y, Wang D, Meng R, Fang J, Luo Y, Liang W, Hu S, Wang Z, Song K, Li Y, Yang L, Shi W, Lu S.",Lancet Oncol. 2025 Apr;26(4):437-446. doi: 10.1016/S1470-2045(25)00012-9. Epub 2025 Feb 25.,Li Z,Lancet Oncol,2025,2025/2/28,,,10.1016/S1470-2045(25)00012-9,https://pubmed.ncbi.nlm.nih.gov/40020696/,https://linkinghub.elsevier.com/retrieve/pii/S1470-2045(25)00012-9,,skipped,row_exception:Error
40016191,"Safety, pharmacokinetics and efficacy of HA121-28 in patients with advanced solid tumors and RET fusion-positive non-small-cell lung cancer: a multicenter, open-label, single-arm phase 1/2 trial","Ruan DY, Huang WW, Li Y, Zhao Y, Shi Y, Jia Y, Cang S, Zhang W, Shi J, Chen J, Lin J, Liu Y, Xu J, Ouyang W, Fang J, Zhuang W, Liu C, Bu Q, Li M, Meng X, Sun M, Yang N, Dong X, Pan Y, Li X, Qu X, Zhang T, Yuan X, Hu S, Guo W, Li Y, Li S, Liu D, Song F, Tan L, Yu Y, Yu X, Zang A, Sun C, Zhang Q, Zou K, Dan M, Xu RH, Zhao H.",Signal Transduct Target Ther. 2025 Feb 28;10(1):62. doi: 10.1038/s41392-025-02155-5.,Ruan DY,Signal Transduct Target Ther,2025,2025/2/27,PMC11868595,,10.1038/s41392-025-02155-5,https://pubmed.ncbi.nlm.nih.gov/40016191/,https://pmc.ncbi.nlm.nih.gov/articles/PMC11868595/,https://pmc.ncbi.nlm.nih.gov/articles/PMC11868595/pdf/41392_2025_Article_2155.pdf,success,
40015915,Prognostic Value of FDG PET Metabolic Parameters Before and After 42 Gy of Radiochemotherapy in Patients with Inoperable Stage III Nonsmall Cell Lung Cancer,"Vera P, Giraud P, Hapdey S, Gouel P, Jan O, Le Roux P, Langlais A, Lévêque E, Le Tinier F, Olivier A, Martin E, Berriolo-Riedinger A, Pourel N, Broglia JM, Boisselier P, Guillemard S, Salem N, Brenot-Rossi I, Garcia C, Berthold C, Giroux-Leprieur E, Moreau D, Guillerm S, Benali K, Tessonnier L, Audigier-Valette C, Lerouge D, Quak E, Massabeau C, Courbon F, Loo M, Larrouy A, Ghazzar N, Chaumet-Riffaud P, Amour E, Zalcman G, Modzelewski R, Thureau S.",J Nucl Med. 2025 Apr 1;66(4):516-524. doi: 10.2967/jnumed.124.268499.,Vera P,J Nucl Med,2025,2025/2/27,,,10.2967/jnumed.124.268499,https://pubmed.ncbi.nlm.nih.gov/40015915/,https://doi.org/10.2967/jnumed.124.268499,,skipped,"https://jnm.snmjournals.org/content/jnumed/early/2025/02/27/jnumed.124.268499.full.pdf -> HTTP 403 | 403:text/html; charset=UTF-8:<!DOCTYPE html><html lang=""en-US""><head><title>Just a moment...</title><meta htt"
39999636,"Long-term outcomes of neoadjuvant gefitinib in resectable stage II-IIIA non-small cell lung cancer: A phase II, prospective cohort study","Ma Z, Fu F, Zhang Y, Chen H.",Lung Cancer. 2025 Mar;201:108457. doi: 10.1016/j.lungcan.2025.108457. Epub 2025 Feb 22.,Ma Z,Lung Cancer,2025,2025/2/25,,,10.1016/j.lungcan.2025.108457,https://pubmed.ncbi.nlm.nih.gov/39999636/,https://linkinghub.elsevier.com/retrieve/pii/S0169-5002(25)00078-9,,skipped,row_exception:Error
39999435,Digital Therapeutics-Based Cardio-Oncology Rehabilitation for Lung Cancer Survivors: Randomized Controlled Trial,"Li G, Zhou X, Deng J, Wang J, Ai P, Zeng J, Ma X, Liao H.",JMIR Mhealth Uhealth. 2025 Feb 25;13:e60115. doi: 10.2196/60115.,Li G,JMIR Mhealth Uhealth,2025,2025/2/25,PMC11897676,,10.2196/60115,https://pubmed.ncbi.nlm.nih.gov/39999435/,https://pmc.ncbi.nlm.nih.gov/articles/PMC11897676/,https://pmc.ncbi.nlm.nih.gov/articles/instance/11897676/bin/mhealth_v13i1e60115_app1.pdf,success,
39998620,"A phase 1 study of the combination of BH3-mimetic, navitoclax, and mTORC1/2 inhibitor, vistusertib, in patients with advanced solid tumors","Scott SC, Farago A, Lai WV, Zahurak M, Rudek MA, Murray J, Carducci MA, Uziel T, Takebe N, Gore SD, Rudin CM, Hann CL.",Cancer Chemother Pharmacol. 2025 Feb 25;95(1):37. doi: 10.1007/s00280-025-04760-1.,Scott SC,Cancer Chemother Pharmacol,2025,2025/2/25,PMC12235654,NIHMS2089682,10.1007/s00280-025-04760-1,https://pubmed.ncbi.nlm.nih.gov/39998620/,https://pmc.ncbi.nlm.nih.gov/articles/PMC12235654/,https://pmc.ncbi.nlm.nih.gov/articles/PMC12235654/pdf/nihms-2089682.pdf,success,
39998510,Augmented reality guided versus computed tomography guided percutaneous lung nodule localization: a noninferiority randomized clinical trial,"Song Z, Li Y, Tian Q, Sun C, Liu H, Chong K, Zhang Q, Chen J, Li P, Song L, Tosi D, Kim MP, Lin Z, Luo Q, Yu L, Cheng X.",Int J Surg. 2025 Apr 1;111(4):2933-2941. doi: 10.1097/JS9.0000000000002308.,Song Z,Int J Surg,2025,2025/2/25,PMC12175789,,10.1097/JS9.0000000000002308,https://pubmed.ncbi.nlm.nih.gov/39998510/,https://pmc.ncbi.nlm.nih.gov/articles/PMC12175789/,https://pmc.ncbi.nlm.nih.gov/articles/PMC12175789/pdf/js9-111-2933.pdf,success,
39994201,Anti-PD1 based precision induction therapy in unresectable stage III non-small cell lung cancer: a phase II umbrella clinical trial,"Yi C, Bian D, Wang J, Hu S, Sun L, Yan Y, Wang S, Shen Z, Yu H, Yang Y, Zhou Y, Liu X, Song N, Zhu Y, Zhao D, Jiang G, Duan L, He W, Xie D, Dai J, Zhang L, Zhang P.",Nat Commun. 2025 Feb 24;16(1):1932. doi: 10.1038/s41467-025-57184-z.,Yi C,Nat Commun,2025,2025/2/24,PMC11850889,,10.1038/s41467-025-57184-z,https://pubmed.ncbi.nlm.nih.gov/39994201/,https://pmc.ncbi.nlm.nih.gov/articles/PMC11850889/,https://pmc.ncbi.nlm.nih.gov/articles/PMC11850889/pdf/41467_2025_Article_57184.pdf,success,
39993594,Diagnostic Yield and Synergistic Impact of Needle Aspiration and Forceps Biopsy With Electromagnetic Navigation Bronchoscopy for Peripheral Pulmonary Lesions: A Randomized Controlled Trial,"Kim YW, Kim HJ, Kwon BS, Lee YJ, Song MJ, Yoon SH, Lim SY, Lee YJ, Park JS, Cho YJ, Lee KH, Chung JH, Han YB, Maldonado F, Ahn SY, Park Y, Joo DH, Lee JH, Lee CT.",Chest. 2025 Jul;168(1):236-247. doi: 10.1016/j.chest.2025.02.015. Epub 2025 Feb 22.,Kim YW,Chest,2025,2025/2/24,,,10.1016/j.chest.2025.02.015,https://pubmed.ncbi.nlm.nih.gov/39993594/,https://doi.org/10.1016/j.chest.2025.02.015,,skipped,row_exception:Error
39992021,Anamorelin Efficacy in Non-Small-Cell Lung Cancer Patients With Cachexia: Insights From ROMANA 1 and ROMANA 2,"Laird BJA, Skipworth R, Bonomi PD, Fallon M, Kaasa S, Giorgino R, McMillan DC, Currow DC.",J Cachexia Sarcopenia Muscle. 2025 Feb;16(1):e13732. doi: 10.1002/jcsm.13732.,Laird BJA,J Cachexia Sarcopenia Muscle,2025,2025/2/24,PMC11848863,,10.1002/jcsm.13732,https://pubmed.ncbi.nlm.nih.gov/39992021/,https://pmc.ncbi.nlm.nih.gov/articles/PMC11848863/,https://pmc.ncbi.nlm.nih.gov/articles/PMC11848863/pdf/JCSM-16-e13732.pdf,success,
39988438,[Application Research of Narrative Care to the Management of Symptom Clusters and Post-traumatic Growth in Patients Undergoing Lung Cancer Surgery],"Sun X, Wang Y, Lv W, Zhu L.",Zhongguo Fei Ai Za Zhi. 2025 Jan 20;28(1):40-46. doi: 10.3779/j.issn.1009-3419.2024.102.44.,Sun X,Zhongguo Fei Ai Za Zhi,2025,2025/2/23,PMC11848649,,10.3779/j.issn.1009-3419.2024.102.44,https://pubmed.ncbi.nlm.nih.gov/39988438/,https://pmc.ncbi.nlm.nih.gov/articles/PMC11848649/,https://pmc.ncbi.nlm.nih.gov/articles/PMC11848649/pdf/zgfazz-28-1-40.pdf,success,
39983444,"ENDOLUNG trial, part II. A phase II study of the Akt/mTOR inhibitor and autophagy inducer ibrilatazar (ABTL0812) in combination with paclitaxel/carboplatin in patients with squamous non-small cell lung cancer","Bosch-Barrera J, Estévez-García P, Martín-Martorell P, Sabatier R, Nadal E, Sais E, Gascón P, Oaknin A, Rodon J, Lizcano JM, Muñoz-Guardiola P, Fierro-Durán G, Pedrós-Gámez O, Pérez-Montoyo H, Yeste-Velasco M, Cortal M, Pérez-Campos A, Alfón J, Domènech C, Morán T.",Lung Cancer. 2025 Mar;201:108105. doi: 10.1016/j.lungcan.2025.108105. Epub 2025 Feb 7.,Bosch-Barrera J,Lung Cancer,2025,2025/2/21,,,10.1016/j.lungcan.2025.108105,https://pubmed.ncbi.nlm.nih.gov/39983444/,https://linkinghub.elsevier.com/retrieve/pii/S0169-5002(25)00026-1,,skipped,row_exception:Error
39983053,"Selpercatinib in RET Fusion-Positive Non-Small Cell Lung Cancer: Final Safety and Efficacy, Including Overall Survival, From the LIBRETTO-001 Phase I/II Trial","Gautschi O, Park K, Solomon BJ, Tomasini P, Loong HH, De Braud F, Goto K, Peterson P, Barker S, Liming K, Oxnard GR, Frimodt-Moller B, Drilon A.",J Clin Oncol. 2025 May 20;43(15):1758-1764. doi: 10.1200/JCO-24-02076. Epub 2025 Feb 21.,Gautschi O,J Clin Oncol,2025,2025/2/21,PMC12084017,NIHMS2050082,10.1200/JCO-24-02076,https://pubmed.ncbi.nlm.nih.gov/39983053/,https://pmc.ncbi.nlm.nih.gov/articles/PMC12084017/,https://pmc.ncbi.nlm.nih.gov/articles/PMC12084017/pdf/jco-43-1758.pdf,success,
39982729,Algorithm-Based Palliative Care in Patients With Cancer: A Cluster Randomized Clinical Trial,"Parikh RB, Ferrell WJ, Li Y, Chen J, Bilbrey L, Johnson N, White J, Sedhom R, Dickson NR, Schleicher S, Bekelman JE, Mudumbi S.",JAMA Netw Open. 2025 Feb 3;8(2):e2458576. doi: 10.1001/jamanetworkopen.2024.58576.,Parikh RB,JAMA Netw Open,2025,2025/2/21,PMC11846008,,10.1001/jamanetworkopen.2024.58576,https://pubmed.ncbi.nlm.nih.gov/39982729/,https://pmc.ncbi.nlm.nih.gov/articles/PMC11846008/,https://communityoncology.org/wp-content/uploads/2017/08/What-is-Comm-Onc.pdf,success,
39970877,First-in-human phase 1 study of an orally bioavailable vascular-disrupting agent DX1002 in patients with advanced solid tumors,"Wei XL, Wu HX, Ruan DY, Wang F, Xu L, Li YH, Ma YX, Wang ZQ, Yang YP, Tang LW, Chen BL, Yong ZQ, Xu RH, Zhao HY.",Cell Rep Med. 2025 Feb 18;6(2):101969. doi: 10.1016/j.xcrm.2025.101969.,Wei XL,Cell Rep Med,2025,2025/2/19,PMC11866551,,10.1016/j.xcrm.2025.101969,https://pubmed.ncbi.nlm.nih.gov/39970877/,https://pmc.ncbi.nlm.nih.gov/articles/PMC11866551/,https://pmc.ncbi.nlm.nih.gov/articles/PMC11866551/pdf/main.pdf,success,
39965131,Why Women Appear to Have Better Outcomes When Undergoing Screening for Lung Cancer,"Silvestri GA, Ward RC, Scott RJ, Katki H, Landy R, Young RP.",Ann Am Thorac Soc. 2025 Jun;22(6):925-933. doi: 10.1513/AnnalsATS.202408-863OC.,Silvestri GA,Ann Am Thorac Soc,2025,2025/2/18,PMC12392790,,10.1513/AnnalsATS.202408-863OC,https://pubmed.ncbi.nlm.nih.gov/39965131/,https://pmc.ncbi.nlm.nih.gov/articles/PMC12392790/,https://pmc.ncbi.nlm.nih.gov/articles/PMC12392790/pdf/AnnalsATS.202408-863OC.pdf,success,
39964268,SPECT/CT Dosimetry of Bronchial Artery (99m)Tc Macroaggregated Albumin Injection in Pulmonary Malignancies: Feasibility Evaluation of Bronchial Artery (90)Y Radioembolization,"Wehrenberg-Klee E, An T, Heidari P, Huesa-Berral C, Dreher MR, Eldridge A, Fowers K, Schuemann J, Bertolet A.",Radiology. 2025 Feb;314(2):e240331. doi: 10.1148/radiol.240331.,Wehrenberg-Klee E,Radiology,2025,2025/2/18,PMC11868849,,10.1148/radiol.240331,https://pubmed.ncbi.nlm.nih.gov/39964268/,https://pmc.ncbi.nlm.nih.gov/articles/PMC11868849/,https://pmc.ncbi.nlm.nih.gov/articles/PMC11868849/pdf/radiol.240331.pdf,success,
39962074,"Induction chemotherapy followed by camrelizumab plus apatinib and chemotherapy as first-line treatment for extensive-stage small-cell lung cancer: a multicenter, single-arm trial","Liu M, Qiu G, Guan W, Xie X, Lin X, Xie Z, Zhang J, Qin Y, Du H, Chen X, Deng Y, Li S, Zhong N, Zhou C.",Signal Transduct Target Ther. 2025 Feb 18;10(1):65. doi: 10.1038/s41392-025-02153-7.,Liu M,Signal Transduct Target Ther,2025,2025/2/17,PMC11833049,,10.1038/s41392-025-02153-7,https://pubmed.ncbi.nlm.nih.gov/39962074/,https://pmc.ncbi.nlm.nih.gov/articles/PMC11833049/,https://pmc.ncbi.nlm.nih.gov/articles/PMC11833049/pdf/41392_2025_Article_2153.pdf,success,
39938593,Lurbinectedin Plus Pembrolizumab in Relapsed SCLC: The Phase I/II LUPER Study,"Calles A, Navarro A, Doger de Speville Uribe BG, Colomé EÁ, de Miguel M, Álvarez R, Arregui M, Moreno V, Rocha P, Calvo E, Ramon-Patino J, Corral de la Fuente E, Alcalá-López D, Boix O, Fernández-Pinto M, Rodríguez-Morató J, Palmero R, Nadal E, Jove M, Felip E.",J Thorac Oncol. 2025 Jul;20(7):969-982. doi: 10.1016/j.jtho.2025.02.005. Epub 2025 Feb 10.,Calles A,J Thorac Oncol,2025,2025/2/12,,,10.1016/j.jtho.2025.02.005,https://pubmed.ncbi.nlm.nih.gov/39938593/,https://linkinghub.elsevier.com/retrieve/pii/S1556-0864(25)00064-4,,skipped,https://www.jto.org/article/S1556-0864(25)00064-4/pdf -> host_blocked_cached:www.jto.org
39938469,Pilot Randomized Trial of an Educational Intervention About Immunotherapy for Patients With Advanced Cancer and Their Caregivers,"Petrillo LA, Hsu K, Pintro K, Rabideau DJ, Zhou AZ, Sarathy R, Tran A, Sullivan R, Reynolds KL, El-Jawahri A, Volandes A, Greer JA, Temel JS.",J Natl Compr Canc Netw. 2025 Feb;23(2):12-20. doi: 10.6004/jnccn.2024.7079.,Petrillo LA,J Natl Compr Canc Netw,2025,2025/2/12,,,10.6004/jnccn.2024.7079,https://pubmed.ncbi.nlm.nih.gov/39938469/,https://doi.org/10.6004/jnccn.2024.7079,https://jnccn.org/downloadpdf/view/journals/jnccn/23/2/article-p12.pdf,success,
39934398,Dexamethasone as an adjuvant with ropivacaine in thoracoscopy guided thoracic paravertebral block for postoperative analgesia in thoracic surgery,"Wu KW, Deng SY, Zhang XF, Zheng DW, Hu LH.",Sci Rep. 2025 Feb 11;15(1):5038. doi: 10.1038/s41598-025-89064-3.,Wu KW,Sci Rep,2025,2025/2/11,PMC11814119,,10.1038/s41598-025-89064-3,https://pubmed.ncbi.nlm.nih.gov/39934398/,https://pmc.ncbi.nlm.nih.gov/articles/PMC11814119/,https://pmc.ncbi.nlm.nih.gov/articles/PMC11814119/pdf/41598_2025_Article_89064.pdf,success,
