PMID,Title,Authors,Citation,First Author,Journal/Book,Publication Year,Create Date,PMCID,NIHMS ID,DOI,pubmed_url,second_link,pdf_url,download_status,download_error
40627448,NOTCH1 reverses immune suppression in small cell lung cancer through reactivation of STING,"Kim YS, Nabet BY, Cortez BN, Sun NY, Sebastian R, Redon CE, Ray A, Liu L, Ishola AA, Loew S, Dhall A, Sindiri S, Gayevskiy V, Lee MJ, Rastogi S, Sato N, Kedei N, Andresson T, Das S, Kumar S, Bers AE, Zhang H, Chiappori A, Gopal P, Abazeed ME, Chen H, Aladjem MI, Pommier Y, Velez MJ, Shames DS, Roper N.",J Clin Invest. 2025 Jul 8;135(18):e185423. doi: 10.1172/JCI185423. eCollection 2025 Sep 16.,Kim YS,J Clin Invest,2025,2025/7/8,PMC12435836,,10.1172/JCI185423,https://pubmed.ncbi.nlm.nih.gov/40627448/,https://pmc.ncbi.nlm.nih.gov/articles/PMC12435836/,https://pmc.ncbi.nlm.nih.gov/articles/PMC12435836/pdf/jci-135-185423.pdf,success,
40618881,"Efficacy and safety of sunvozertinib monotherapy as first-line treatment in NSCLC patients with EGFR exon 20 insertion mutations: A phase 2, single-center trial","Xu Y, Chen M, Gao X, Liu X, Zhao J, Zhong W, Wang M, Lang H, Yip C, Wang M.",Cancer Lett. 2025 Oct 10;630:217904. doi: 10.1016/j.canlet.2025.217904. Epub 2025 Jul 5.,Xu Y,Cancer Lett,2025,2025/7/6,,,10.1016/j.canlet.2025.217904,https://pubmed.ncbi.nlm.nih.gov/40618881/,https://linkinghub.elsevier.com/retrieve/pii/S0304-3835(25)00472-0,,skipped,row_exception:Error
40617394,"Lazertinib Versus Osimertinib in Previously Untreated EGFR-Mutant Advanced NSCLC: A Randomized, Double-Blind, Exploratory Analysis From MARIPOSA","Lee SH, Lu S, Hayashi H, Felip E, Spira AI, Girard N, Kim YJ, Ostapenko Y, Danchaivijitr P, Liu B, Alip A, Korbenfeld E, Dias JM, Lee KH, Xiong H, How SH, Cheng Y, Chang GC, Chih-Hsin Yang J, Besse B, Thomas M, Shah S, Baig M, Curtin JC, Zhang J, Xie J, Sun T, Sethi S, Wang M, Fennema E, Daksh M, Ennis M, Bauml JM, Cho BC.",J Thorac Oncol. 2025 Nov;20(11):1655-1668. doi: 10.1016/j.jtho.2025.06.030. Epub 2025 Jul 3.,Lee SH,J Thorac Oncol,2025,2025/7/5,,,10.1016/j.jtho.2025.06.030,https://pubmed.ncbi.nlm.nih.gov/40617394/,https://doi.org/10.1016/j.jtho.2025.06.030,,skipped,row_exception:Error
40614783,"""Hope"" Drives Quality of Life in Patients With Brain Metastases, But, the ""Hope Center"" Remains Elusive: An Analysis of NRG-CC003","Corn BW, Paulus R, Gondi V, Mehta MP, Fogh S, Wefel JS, Videtic GM, Sun A, Yoon H, Heinzerling JH, McGarry RC, Kundapur V, Devisetty K, Wu A, McCarron EC, Pollock J, Kanner AA, Feldman DB, Pugh SL, Kachnic LA, Movsas B.",Int J Radiat Oncol Biol Phys. 2025 Nov 1;123(3):642-652. doi: 10.1016/j.ijrobp.2025.06.3884. Epub 2025 Jul 2.,Corn BW,Int J Radiat Oncol Biol Phys,2025,2025/7/4,PMC12494067,NIHMS2110198,10.1016/j.ijrobp.2025.06.3884,https://pubmed.ncbi.nlm.nih.gov/40614783/,https://pmc.ncbi.nlm.nih.gov/articles/PMC12494067/,https://pmc.ncbi.nlm.nih.gov/articles/PMC12494067/pdf/nihms-2110198.pdf,success,
40614659,"Platinum plus etoposide with durvalumab for extensive-stage small-cell lung cancer with untreated brain metastases: a multicenter, single-arm phase II trial (LOGiK2001, SPEED)","Shiraishi Y, Shimose T, Tsuchiya-Kawano Y, Ishii H, Mizuno K, Toi Y, Daga H, Ito K, Iyama S, Taniguchi H, Morinaga R, Harada T, Inoue H, Misumi Y, Naoki K, Tobino K, Izumi M, Omori S, Tsumura S, Yamanaka Y, Sakata Y, Miura S, Mizutani H, Oki M, Iwama E, Otsubo K, Okamoto I.",ESMO Open. 2025 Jul;10(7):105325. doi: 10.1016/j.esmoop.2025.105325. Epub 2025 Jul 3.,Shiraishi Y,ESMO Open,2025,2025/7/4,PMC12270619,,10.1016/j.esmoop.2025.105325,https://pubmed.ncbi.nlm.nih.gov/40614659/,https://pmc.ncbi.nlm.nih.gov/articles/PMC12270619/,https://pmc.ncbi.nlm.nih.gov/articles/PMC12270619/pdf/main.pdf,success,
40613383,The Impact of Machine Learning Mortality Risk Prediction on Clinician Prognostic Accuracy and Decision Support: A Randomized Vignette Study,"Parikh RB, Ferrell WJ, Girard A, White J, Fang S, Bekelman JE, Schapira MM.",Med Decis Making. 2025 Aug;45(6):690-702. doi: 10.1177/0272989X251349489. Epub 2025 Jul 4.,Parikh RB,Med Decis Making,2025,2025/7/4,PMC12233153,NIHMS2086000,10.1177/0272989X251349489,https://pubmed.ncbi.nlm.nih.gov/40613383/,https://pmc.ncbi.nlm.nih.gov/articles/PMC12233153/,https://pmc.ncbi.nlm.nih.gov/articles/PMC12233153/pdf/10.1177_0272989X251349489.pdf,success,
40609842,"Low-dose Radiation Therapy Concurrent With Atezolizumab and Chemotherapy as First-Line Treatment for Extensive-Stage Small Cell Lung Cancer: 3-Year Follow-up of a Multicenter, Single-arm, Phase 2 Trial (MATCH)","Zhou L, Sun J, Xie C, Kang K, Yao Z, Gong Y, Huang M, Wang H, Wu L, Yuan Z, Bi N, Fan M, Xu Y, Chen Y, Lu Y; MATCH Study Investigators.",Int J Radiat Oncol Biol Phys. 2026 Jan 1;124(1):164-173. doi: 10.1016/j.ijrobp.2025.06.3872. Epub 2025 Jul 1.,Zhou L,Int J Radiat Oncol Biol Phys,2026,2025/7/3,,,10.1016/j.ijrobp.2025.06.3872,https://pubmed.ncbi.nlm.nih.gov/40609842/,https://doi.org/10.1016/j.ijrobp.2025.06.3872,,skipped,"https://www.redjournal.org/article/S0360-3016(25)04508-0/pdf -> HTTP 403 | 403:text/html; charset=UTF-8:<!DOCTYPE html><html lang=""en-US""><head><title>Just a moment...</title><meta htt"
40602204,Phase III study of ramucirumab plus docetaxel versus atezolizumab for previously treated PD-L1 low or negative advanced non-small-cell lung cancer: WJOG10317L study,"Zenke Y, Niho S, Toi Y, Yamaguchi M, Hara S, Akazawa Y, Hosomi Y, Yonesaka K, Akamatsu H, Yokoyama T, Tanizaki J, Ueno K, Gyotoku H, Misumi T, Nakagawa K, Yamamoto N, Tsuboi M.",Lung Cancer. 2025 Aug;206:108633. doi: 10.1016/j.lungcan.2025.108633. Epub 2025 Jun 23.,Zenke Y,Lung Cancer,2025,2025/7/2,,,10.1016/j.lungcan.2025.108633,https://pubmed.ncbi.nlm.nih.gov/40602204/,https://doi.org/10.1016/j.lungcan.2025.108633,,skipped,row_exception:Error
40599293,[Esketamine Alleviates Postoperative Depressive Symptoms in Frail Elderly Patients Undergoing Thoracoscopic Radical Resection of Lung Cancer: A Randomized Double-Blind Controlled Trial],"Zhang C, Yan Y, Ma J, Wang K, Liu D, Zhang Y, Li X, Ren L.",Sichuan Da Xue Xue Bao Yi Xue Ban. 2025 Mar 20;56(2):506-513. doi: 10.12182/20250360202.,Zhang C,Sichuan Da Xue Xue Bao Yi Xue Ban,2025,2025/7/2,PMC12207054,,10.12182/20250360202,https://pubmed.ncbi.nlm.nih.gov/40599293/,https://pmc.ncbi.nlm.nih.gov/articles/PMC12207054/,https://pmc.ncbi.nlm.nih.gov/articles/PMC12207054/pdf/scdxxbyxb-56-2-506.pdf,success,
40595495,Identification of the Notch ligand DLK1 as an immunotherapeutic target and regulator of tumor cell plasticity and chemoresistance in adrenocortical carcinoma,"Sun NY, Kumar S, Kim YS, Varghese D, Mendoza A, Nguyen R, Okada R, Reilly K, Widemann B, Pommier Y, Elloumi F, Dhall A, Taniyama D, Patel M, Aber E, Contreras CF, Kaplan RN, Kiseljak-Vassiliades K, Wierman ME, Martinez D, Pogoriler J, Hamilton AK, Diskin SJ, Maris JM, Robey RW, Gottesman MM, Del Rivero J, Roper N.",Nat Commun. 2025 Jul 1;16(1):5511. doi: 10.1038/s41467-025-60649-w.,Sun NY,Nat Commun,2025,2025/7/2,PMC12216638,,10.1038/s41467-025-60649-w,https://pubmed.ncbi.nlm.nih.gov/40595495/,https://pmc.ncbi.nlm.nih.gov/articles/PMC12216638/,https://pmc.ncbi.nlm.nih.gov/articles/PMC12216638/pdf/41467_2025_Article_60649.pdf,success,
40593014,Osimertinib plus chemotherapy versus osimertinib for patients with advanced NSCLC with concomitant EGFR and TP53 mutations: a prospective cohort study,"Li J, Zhan X, Shao M, Zeng R, Li J, Zhu H, Feng A, Yang Z, Jing W.",Sci Rep. 2025 Jul 1;15(1):20952. doi: 10.1038/s41598-025-03422-9.,Li J,Sci Rep,2025,2025/7/1,PMC12219119,,10.1038/s41598-025-03422-9,https://pubmed.ncbi.nlm.nih.gov/40593014/,https://pmc.ncbi.nlm.nih.gov/articles/PMC12219119/,https://pmc.ncbi.nlm.nih.gov/articles/PMC12219119/pdf/41598_2025_Article_3422.pdf,success,
40586961,A mobile supportive care app for patients with metastatic lung cancer: the Lung Cancer App (LuCApp) randomized controlled trial,"Pongiglione B, Cucciniello M, Petracca F, Ciani O, Novello S, Migliorino M, Pedrazzoli P, Agustoni F, Lo Russo G, Tarricone R, Capelletto E.",Support Care Cancer. 2025 Jun 30;33(7):641. doi: 10.1007/s00520-025-09682-5.,Pongiglione B,Support Care Cancer,2025,2025/6/30,,,10.1007/s00520-025-09682-5,https://pubmed.ncbi.nlm.nih.gov/40586961/,https://doi.org/10.1007/s00520-025-09682-5,https://link.springer.com/article/10.1007/s00520-025-09682-5,success,
40586764,"Phase I trial of SPH4336, a novel cyclin-dependent kinase 4/6 inhibitor, in patients with advanced solid tumors","Jiang Y, Liang X, Sun ML, Gao G, Gong Y, Li HP, Liu J, Wang YS.",Oncologist. 2025 Jun 4;30(6):oyaf077. doi: 10.1093/oncolo/oyaf077.,Jiang Y,Oncologist,2025,2025/6/30,PMC12207880,,10.1093/oncolo/oyaf077,https://pubmed.ncbi.nlm.nih.gov/40586764/,https://pmc.ncbi.nlm.nih.gov/articles/PMC12207880/,https://pmc.ncbi.nlm.nih.gov/articles/PMC12207880/pdf/oyaf077.pdf,success,
40582920,Activity of Brigatinib in Patients With Crizotinib-Resistant ALK-positive Non-Small-Cell Lung Cancer According to ALK Fusion and Mutation Status,"Bazhenova L, Hodgson JG, Camidge DR, Langer CJ, Huber RM, Kim DW, Reckamp KL, Ahn MJ, Tan DSW, Patel JD, Vincent S, Li C, Humphries MJ, Zhang P, Rivera VM, Gettinger S.",Clin Lung Cancer. 2025 Nov;26(7):e503-e513.e11. doi: 10.1016/j.cllc.2025.05.016. Epub 2025 Jun 6.,Bazhenova L,Clin Lung Cancer,2025,2025/6/29,,,10.1016/j.cllc.2025.05.016,https://pubmed.ncbi.nlm.nih.gov/40582920/,https://doi.org/10.1016/j.cllc.2025.05.016,,skipped,row_exception:Error
40578381,"Adjuvant chemotherapy for stage IA-IIA non-squamous, non-small-cell lung cancer identified as molecular high-risk by a 14-gene expression profile (AIM-HIGH): an international, randomised, phase 3 trial","Spigel DR, Westeel V, Anderson IC, Greillier L, Guisier F, Bylicki O, Badin FB, Rousseau-Bussac G, Deldycke C, Griesinger F, Bograd A, Zhong W, Le Treut J, Van Hulst S, Gandara DR, Reck M, Hoffknecht P, Gubens MA, Crowley J, von der Leyen H, Woodard GA, Jablons DM, Kratz JR, Mann MJ; AIM-HIGH investigators.",Lancet Respir Med. 2025 Oct;13(10):887-896. doi: 10.1016/S2213-2600(25)00213-9. Epub 2025 Jun 24.,Spigel DR,Lancet Respir Med,2025,2025/6/27,,,10.1016/S2213-2600(25)00213-9,https://pubmed.ncbi.nlm.nih.gov/40578381/,https://linkinghub.elsevier.com/retrieve/pii/S2213-2600(25)00213-9,,skipped,https://www.thelancet.com/action/showPdf?pii=S2213260025002139 -> host_blocked_cached:www.thelancet.com
40578313,Quality comparison of mediastinal lymph node dissection between video-assisted thoracic surgery and open thoracotomy: a supplementary analysis of the phase 3 Japan Clinical Oncology Group 1413 trial†,"Tsubokawa N, Tsutani Y, Hishida T, Saji H, Wakabayashi M, Endo M, Mimae T, Miyoshi T, Isaka T, Isaka M, Hattori A, Yoshioka H, Nakajima R, Yotsukura M, Maniwa T, Sekino Y, Fukuda H, Nakagawa K, Aokage K, Watanabe SI, Okada M.",Eur J Cardiothorac Surg. 2025 Jul 1;67(7):ezaf206. doi: 10.1093/ejcts/ezaf206.,Tsubokawa N,Eur J Cardiothorac Surg,2025,2025/6/27,,,10.1093/ejcts/ezaf206,https://pubmed.ncbi.nlm.nih.gov/40578313/,https://academic.oup.com/ejcts/article-lookup/doi/10.1093/ejcts/ezaf206,,skipped,"https://academic.oup.com/ejcts/article-pdf/67/7/ezaf206/63529786/ezaf206.pdf -> HTTP 403 | 403:text/html; charset=UTF-8:<!DOCTYPE html><html lang=""en-US""><head><title>Just a moment...</title><meta htt"
40569623,High-Dose Aumolertinib for Untreated EGFR-Variant Non-Small Cell Lung Cancer With Brain Metastases: The ACHIEVE Phase 2 Nonrandomized Clinical Trial,"Li H, Chen K, Gong L, Qin J, Jin Y, Zhou R, Huang Z, Xu Y, Xu X, He J, Zhu J, Yu S, Lu H, Xu Y, Yu X, Han G, Chen J, Tan W, Lou G, Ren B, Chen X, Zhang D, Wang W, Shi X, Xie F, Zhao J, Han N, Li B, Fan Y.",JAMA Oncol. 2025 Aug 1;11(8):900-908. doi: 10.1001/jamaoncol.2025.1779.,Li H,JAMA Oncol,2025,2025/6/26,PMC12203398,,10.1001/jamaoncol.2025.1779,https://pubmed.ncbi.nlm.nih.gov/40569623/,https://pmc.ncbi.nlm.nih.gov/articles/PMC12203398/,https://pmc.ncbi.nlm.nih.gov/articles/instance/12203398/bin/jamaoncol-e251779-s001.pdf,success,
40561860,Gegen Qinlian Tablets attenuate immune-related adverse events in NSCLC patients: A multi-center randomized controlled trial in China,"Lu X, Wang A, Chen D, Yang M, Zhang Y, Liu M, Zhang X, Li Y, Liu D, Wang Y, Cheng Z, Li L, Cui H.",Phytomedicine. 2025 Sep;145:156968. doi: 10.1016/j.phymed.2025.156968. Epub 2025 Jun 15.,Lu X,Phytomedicine,2025,2025/6/25,,,10.1016/j.phymed.2025.156968,https://pubmed.ncbi.nlm.nih.gov/40561860/,https://doi.org/10.1016/j.phymed.2025.156968,https://www.sciencedirect.com/science/article/pii/S0944711325006063/pdfft?md5=5368ee6e985c844f35429783175bf71d&pid=1-s2.0-S0944711325006063-main.pdf,skipped,row_exception:Error
40555062,Combination of anlotinib and irinotecan as second-line therapy in extensive-stage small-cell lung cancer relapsed within six months: a single-arm phase Ⅱ study,"Zhang M, Tang Y, Liang J, Zhu L, Wang B, Pan K, Xu X, Chen X, Xia B.",Lung Cancer. 2025 Jul;205:108630. doi: 10.1016/j.lungcan.2025.108630. Epub 2025 Jun 20.,Zhang M,Lung Cancer,2025,2025/6/24,,,10.1016/j.lungcan.2025.108630,https://pubmed.ncbi.nlm.nih.gov/40555062/,https://doi.org/10.1016/j.lungcan.2025.108630,,skipped,https://www.lungcancerjournal.info/action/showPdf?pii=S0169500225005227 -> host_blocked_cached:www.lungcancerjournal.info
40552964,"Survival of Patients with Lung Adenocarcinoma Diagnosed in 2000, 2010, and 2020","Debieuvre D, Falchero L, Molinier O, Couraud S, Cortot A, Meyer N, Asselain B, Auvray E, Templement-Grangerat D, Bizieux A, Tredaniel J, Schneider S, Auliac JB, Bylicki O, Letierce A, Morel H.",NEJM Evid. 2025 Jul;4(7):EVIDoa2400443. doi: 10.1056/EVIDoa2400443. Epub 2025 Jun 24.,Debieuvre D,NEJM Evid,2025,2025/6/24,,,10.1056/EVIDoa2400443,https://pubmed.ncbi.nlm.nih.gov/40552964/,https://evidence.nejm.org/doi/10.1056/EVIDoa2400443?url_ver=Z39.88-2003&rfr_id=ori:rid:crossref.org&rfr_dat=cr_pub%20%200pubmed,,skipped,https://doi.org/10.1056/evidoa2400443 -> HTTP 403
40550238,"Efficacy and safety of limertinib versus gefitinib as first-line treatment for locally advanced or metastatic non-small-cell lung cancer with EGFR-sensitising mutation: a randomised, double-blind, double-dummy, phase 3 trial","Shi Y, Wu L, Ji Y, Chen G, Li B, Bi M, Yang R, Miao L, Zhang G, Gao H, Sun L, Zhang M, Cang S, Sun M, Yao W, Pan Z, Cui J, Xiao Y, Wang Q; NCT04143607 Study Group.",Lancet Respir Med. 2025 Aug;13(8):677-686. doi: 10.1016/S2213-2600(25)00121-3. Epub 2025 Jun 20.,Shi Y,Lancet Respir Med,2025,2025/6/23,,,10.1016/S2213-2600(25)00121-3,https://pubmed.ncbi.nlm.nih.gov/40550238/,https://doi.org/10.1016/s2213-2600(25)00121-3,,skipped,https://www.thelancet.com/action/showPdf?pii=S2213260025001213 -> host_blocked_cached:www.thelancet.com
40546828,Transcutaneous Electrical Acupoint Stimulation (TEAS) Facilitates Postoperative Recovery in Day Lung Cancer Surgery: A Randomized Controlled Trial,"Wu S, Lou J, Zou H, Wang W, Zhang Y, Xu Y, Hou X, Wu J.",J Pain Res. 2025 Jun 17;18:3017-3026. doi: 10.2147/JPR.S529193. eCollection 2025.,Wu S,J Pain Res,2025,2025/6/23,PMC12182081,,10.2147/JPR.S529193,https://pubmed.ncbi.nlm.nih.gov/40546828/,https://pmc.ncbi.nlm.nih.gov/articles/PMC12182081/,https://pmc.ncbi.nlm.nih.gov/articles/PMC12182081/pdf/jpr-18-3017.pdf,success,
40545237,Surgical Outcomes With Neoadjuvant Durvalumab Plus Chemotherapy Followed by Adjuvant Durvalumab in Resectable NSCLC,"Mitsudomi T, Heymach JV, Reck M, Taube JM, Gao S, Horio Y, You J, Li G, Van Luong D, Saeteng S, Tanaka F, Watzka SB, Urban L, Szalai Z, Akamatsu H, Kang JH, Orlandi FJ, Mukhametshina GZ, Pircher A, Teixeira CHA, Aperghis M, Doherty GJ, Doake R, Fouad TM, Harpole D.",J Thorac Oncol. 2025 Nov;20(11):1639-1654. doi: 10.1016/j.jtho.2025.06.015. Epub 2025 Jun 20.,Mitsudomi T,J Thorac Oncol,2025,2025/6/22,,,10.1016/j.jtho.2025.06.015,https://pubmed.ncbi.nlm.nih.gov/40545237/,https://doi.org/10.1016/j.jtho.2025.06.015,https://www.jto.org/action/showPdf?pii=S1556-0864%2825%2900780-4,skipped,row_exception:Error
40541556,"A Patient-Centric, Open-Label, Multicenter, Phase II Study of Lorlatinib Monotherapy in the First-Line Treatment of Patients With locally Advanced or Metastatic ALK-Positive Non-Small Cell Lung Cancer (CTONG2203)","Lin JX, Zhou Q, Yan HH, Liu AW, Wu GW, Chu Q, Du YY, Cui JW, Cheng Y, Yang Y, Xu HP, Tu HY, Wu YL, Liu SM.",Clin Lung Cancer. 2025 Sep;26(6):515-519. doi: 10.1016/j.cllc.2025.05.014. Epub 2025 May 28.,Lin JX,Clin Lung Cancer,2025,2025/6/20,,,10.1016/j.cllc.2025.05.014,https://pubmed.ncbi.nlm.nih.gov/40541556/,https://doi.org/10.1016/j.cllc.2025.05.014,,skipped,"https://www.clinical-lung-cancer.com/action/showPdf?pii=S1525730425001275 -> HTTP 403 | 403:text/html; charset=UTF-8:<!DOCTYPE html><html lang=""en-US""><head><title>Just a moment...</title><meta htt"
40540649,Diabetes Mellitus and Lung Cancer Screening Outcomes in the National Lung Screening Trial,"Young RP, Ward RC, Scott RJ, Silvestri GA.",Ann Am Thorac Soc. 2025 Sep;22(9):1409-1418. doi: 10.1513/AnnalsATS.202411-1235OC.,Young RP,Ann Am Thorac Soc,2025,2025/6/20,,,10.1513/AnnalsATS.202411-1235OC,https://pubmed.ncbi.nlm.nih.gov/40540649/,https://academic.oup.com/annalsats/article-lookup/doi/10.1513/AnnalsATS.202411-1235OC,,skipped,https://doi.org/10.1513/annalsats.202411-1235oc -> HTTP 403
40532782,The extent of lymph node dissection is not associated with disease-free survival following lobar or sublobar resection: Results from Cancer and Leukemia Group B 140503 (Alliance),"Altorki N, Damman B, Wang X, Liberman M, Wigle D, Ashrafi A, Conti M, Yasufuku K, Schuchert MJ, Stinchcombe TE.",J Thorac Cardiovasc Surg. 2025 Oct;170(4):933-942.e2. doi: 10.1016/j.jtcvs.2025.06.007. Epub 2025 Jun 16.,Altorki N,J Thorac Cardiovasc Surg,2025,2025/6/18,PMC12289341,NIHMS2090561,10.1016/j.jtcvs.2025.06.007,https://pubmed.ncbi.nlm.nih.gov/40532782/,https://doi.org/10.1016/j.jtcvs.2025.06.007,,failed,"https://pmc.ncbi.nlm.nih.gov/articles/PMC12289341/pdf/ -> HTTP 403 | 403:text/html; charset=utf-8:Supplemental document is embargoed | chrome:pmc_embargo_until:June 16, 2026 | chrome:no_pdf_control | firefox:launch_failed:Error"
40531511,"Therapy, Safety, and Logistics of Preoperative vs Postoperative Stereotactic Radiation Therapy: A Preliminary Analysis of a Randomized Clinical Trial","Yeboa DN, Li J, Lin R, Prabhu SS, Beckham TH, Woodhouse K, Swanson TA, Weinberg JS, Wang X, Chi X, Ejezie CL, Suki D, Wang C, Ene C, McCutcheon IE, McGovern S, McAleer MF, Tom M, Ghia A, Perni S, Jiang W, De B, Chung C, Kim BYS, O'Brien BJ, Huse JT, Wefel JS, Court L, Tawbi H, Janku F, Guha-Thakurta N, Debnam JM, Johnson J, Taslicay CA, Alvarez-Breckenridge C, Raza SM, Heimberger AB, DeMonte F, North R, Briere TM, de Groot JF, Sawaya R, Grosshans D, Lang FF, Rao G, Ferguson SD.",JAMA Oncol. 2025 Aug 1;11(8):890-899. doi: 10.1001/jamaoncol.2025.1770.,Yeboa DN,JAMA Oncol,2025,2025/6/18,PMC12177721,,10.1001/jamaoncol.2025.1770,https://pubmed.ncbi.nlm.nih.gov/40531511/,https://pmc.ncbi.nlm.nih.gov/articles/PMC12177721/,https://pmc.ncbi.nlm.nih.gov/articles/instance/12177721/bin/jamaoncol-e251770-s001.pdf,success,
40528050,Impact of preoperative respiratory training on early postoperative recovery in patients undergoing lung cancer surgery: a randomized controlled trial,"Su XE, Hong WP, He HF, Xie B, Wu SH.",Support Care Cancer. 2025 Jun 18;33(7):593. doi: 10.1007/s00520-025-09658-5.,Su XE,Support Care Cancer,2025,2025/6/17,,,10.1007/s00520-025-09658-5,https://pubmed.ncbi.nlm.nih.gov/40528050/,https://doi.org/10.1007/s00520-025-09658-5,https://link.springer.com/article/10.1007/s00520-025-09658-5,success,
40526078,Randomized phase II clinical trial of cisplatin/carboplatin and etoposide (PE) alone or in combination with nivolumab as frontline therapy for extensive-stage small cell lung cancer (ES-SCLC): ECOG-ACRIN EA5161,"Leal TA, Wang Y, Dowlati A, Chay CH, Chen Y, Mohindra AR, Razaq M, Ajuja HG, Liu J, King DM, Sumey CJ, Ramalingam SS.",Cancer. 2025 Jun 15;131(12):e35938. doi: 10.1002/cncr.35938.,Leal TA,Cancer,2025,2025/6/17,PMC12276847,NIHMS2092744,10.1002/cncr.35938,https://pubmed.ncbi.nlm.nih.gov/40526078/,https://doi.org/10.1002/cncr.35938,,failed,"No PDF link found | pmc_embargo_until:June 15, 2026"
40523368,"Sugemalimab versus placebo, in combination with platinum-based chemotherapy, as first-line treatment of metastatic non-small-cell lung cancer (GEMSTONE-302): 4-year outcomes from a double-blind, randomised, phase 3 trial","Zhou C, Wang Z, Sun M, Cao L, Ma Z, Wu R, Yu Y, Yao W, Sun S, Chen J, Zhuang W, Cui J, Chen X, Lu Y, Shen H, Hu C, Liu J, Liu Y, Wang M, Li X, Sun P, Shu Y, Zhou J, Li J, Gu K, Wang C, Zhao H, Zhang Y, Liu C, Yang H, Zhang X, Ma R, Li L, Liang L, Li M, Wang J, Wang Q, Wang B, Dai H, Shi Q, Yang J.",Lancet Oncol. 2025 Jul;26(7):887-897. doi: 10.1016/S1470-2045(25)00198-6. Epub 2025 Jun 13.,Zhou C,Lancet Oncol,2025,2025/6/16,,,10.1016/S1470-2045(25)00198-6,https://pubmed.ncbi.nlm.nih.gov/40523368/,https://doi.org/10.1016/s1470-2045(25)00198-6,https://www.thelancet.com/cms/10.1016/S1470-2045(25)00198-6/attachment/d9edd853-1c3d-4f72-9290-fea137e87ace/mmc1.pdf,failed,"Puppeteer: Execution context was destroyed, most likely because of a navigation. | Axios: HTTP 403"
40522817,A Randomized Trial of Nutrition and Exercise Treatment in Patients With Pancreatic and Non-Small Cell Lung Cancer (NEXTAC-TWO),"Mitsunaga S, Naito T, Imai H, Kimura M, Miura S, Tanaka H, Mizukami T, Imoto A, Kondoh C, Okuyama H, Ueno M, Shiotsu S, Inano T, Chitose H, Tatematsu N, Okayama T, Mouri T, Sugiyama M, Omae K, Kawabata T, Mori K, Takayama K.",J Cachexia Sarcopenia Muscle. 2025 Jun;16(3):e13871. doi: 10.1002/jcsm.13871.,Mitsunaga S,J Cachexia Sarcopenia Muscle,2025,2025/6/16,PMC12169190,,10.1002/jcsm.13871,https://pubmed.ncbi.nlm.nih.gov/40522817/,https://pmc.ncbi.nlm.nih.gov/articles/PMC12169190/,https://pmc.ncbi.nlm.nih.gov/articles/PMC12169190/pdf/JCSM-16-e13871.pdf,success,
40519973,Evaluation of the Effectiveness and Safety Profile of First-Line Immune Checkpoint Inhibitors Combined with Chemotherapy in Pulmonary Sarcomatoid Carcinoma,"Du H, Song X, Wu F.",Lung Cancer (Auckl). 2025 Jun 9;16:73-83. doi: 10.2147/LCTT.S494990. eCollection 2025.,Du H,Lung Cancer (Auckl),2025,2025/6/16,PMC12164836,,10.2147/LCTT.S494990,https://pubmed.ncbi.nlm.nih.gov/40519973/,https://pmc.ncbi.nlm.nih.gov/articles/PMC12164836/,https://pmc.ncbi.nlm.nih.gov/articles/PMC12164836/pdf/lctt-16-73.pdf,success,
40518364,Baseline Characteristics of Participants and Pulmonary Nodules in the Watch the Spot Trial: A Pragmatic Trial of Less versus More Intensive Strategies for Active Surveillance of Patients With Small Pulmonary Nodules,"Gould MK, de Bie E, Qi L, Creekmur B, Mazzone PJ, Mularski RA, Ritzwoller DP, Slatore CG, Vachani A, Walter EC, Wiener RS, Dyer DS, McEvoy CE, Kelly K, Smith-Bindman R, Miglioretti DL; Watch the Spot Investigators.",Clin Lung Cancer. 2025 Sep;26(6):e472-e482.e1. doi: 10.1016/j.cllc.2025.05.011. Epub 2025 May 24.,Gould MK,Clin Lung Cancer,2025,2025/6/15,PMC12600030,NIHMS2121021,10.1016/j.cllc.2025.05.011,https://pubmed.ncbi.nlm.nih.gov/40518364/,https://pmc.ncbi.nlm.nih.gov/articles/PMC12600030/,https://pmc.ncbi.nlm.nih.gov/articles/PMC12600030/pdf/nihms-2121021.pdf,success,
40516821,A Pooled Analysis of Datopotamab Deruxtecan in Patients With EGFR-Mutated NSCLC,"Ahn MJ, Lisberg A, Goto Y, Sands J, Hong MH, Paz-Ares L, Pons-Tostivint E, Pérol M, Felip E, Sugawara S, Hayashi H, Cho BC, Blumenschein G Jr, Shum E, Lee JS, Heist RS, Cornelissen R, Chang WC, Kowalski D, Zebger-Gong H, Chargualaf M, Gu W, Lan L, Howarth P, Joseph R, Okamoto I.",J Thorac Oncol. 2025 Nov;20(11):1669-1682. doi: 10.1016/j.jtho.2025.06.002. Epub 2025 Jun 12.,Ahn MJ,J Thorac Oncol,2025,2025/6/14,,,10.1016/j.jtho.2025.06.002,https://pubmed.ncbi.nlm.nih.gov/40516821/,https://doi.org/10.1016/j.jtho.2025.06.002,https://www.jto.org/action/showPdf?pii=S1556-0864%2825%2900761-0,skipped,"https://pure.eur.nl/files/225382871/A_Pooled_Analysis_of_Datopotamab_Deruxtecan_in_Patients_With_EGFR-Mutated_NSCLC.pdf -> HTTP 403 | 403:text/html; charset=UTF-8:<!DOCTYPE html><html lang=""en-US""><head><title>Just a moment...</title><meta htt"
40512375,Effects of loaded deep breathing training combined with PERMA model in lung cancer patients undergoing surgery: a randomized controlled trial,"Wang Z, Yu L, Song C, Cao H, Yang Z, Qiao S, Li X, Xie J.",Support Care Cancer. 2025 Jun 13;33(7):574. doi: 10.1007/s00520-025-09607-2.,Wang Z,Support Care Cancer,2025,2025/6/13,,,10.1007/s00520-025-09607-2,https://pubmed.ncbi.nlm.nih.gov/40512375/,https://doi.org/10.1007/s00520-025-09607-2,https://link.springer.com/article/10.1007/s00520-025-09607-2,success,
40505764,"Co-Development, Evaluation, and Dissemination of a Lung Cancer Screening Digital Outreach Intervention: A Multiphase Randomized Clinical Trial","Neil JM, Mercaldo ND, Tiersma K, Nelson Z, Lee A, Ballini L, Mao B, Shao R, Irwin K, Carlos RC, Park ER, Flores EJ.",J Am Coll Radiol. 2025 Sep;22(9):1008-1018. doi: 10.1016/j.jacr.2025.06.014. Epub 2025 Jun 10.,Neil JM,J Am Coll Radiol,2025,2025/6/12,,,10.1016/j.jacr.2025.06.014,https://pubmed.ncbi.nlm.nih.gov/40505764/,https://linkinghub.elsevier.com/retrieve/pii/S1546-1440(25)00322-9,,skipped,row_exception:Error
40501447,A randomized comparative study on maintenance gemcitabine versus supportive care in pleural mesothelioma,"Karam AS, Abdelwahab S, Ezz El Din MMA, Alorabi MO.",Future Oncol. 2025 Jul;21(17):2203-2213. doi: 10.1080/14796694.2025.2516412. Epub 2025 Jun 12.,Karam AS,Future Oncol,2025,2025/6/12,PMC12239787,,10.1080/14796694.2025.2516412,https://pubmed.ncbi.nlm.nih.gov/40501447/,https://doi.org/10.1080/14796694.2025.2516412,,failed,"No PDF link found | pmc_embargo_until:June 12, 2026"
